{
  "format": "model-review-queue/1.0",
  "generated_at": "2026-10-13T06:06:29+00:00",
  "note": "Changed=true means a source page's content signature moved since the last check. This is a review signal, not a confirmed model change (landing pages are marketing copy; diffs may be noise). Promote via the per-item promotion step — never auto-mutate models.json. Items with a `status` and no `detected_at` are standing hand-authored watches, preserved across runs by the checker.",
  "pending": 3,
  "items": [
    {
      "model": "Seedance 3.0",
      "status": "reported",
      "note": "Wave 21 (2026-10-11): still unconfirmed. Watch ByteDance Seed's public model directory; any official Seedance 3 announcement should flip status to active with full spec/pricing. Re-checked 2026-10-12 (Watchtower 2.3): no official ByteDance announcement exists in current coverage — watch stays open. Re-checked 2026-10-12 (Watchtower 2.4): still no official announcement; ByteDance's catalog still lists 2.5 as current — watch stays open. Re-checked 2026-10-12 (Watchtower 2.5): still no official announcement — the daily-checked release tracker confirms ByteDance's catalog still lists 2.5 as current (Oct 6 inspection, unchanged) — watch stays open. Re-checked 2026-10-12 (Watchtower 2.6): still no official announcement — the release tracker’s daily inspection is unchanged (its Oct 6 catalog check still lists 2.5 as current, no newer inspection posted) and current coverage agrees none exists — watch stays open. Re-checked 2026-10-12 (Watchtower 2.7): still no official announcement — the state-of-the-field coverage page this watch reads returned a signature identical to the 2.6 baseline and still lists Seedance 3.0 among models with no vendor announcement, no API, and no date — watch stays open. Re-checked 2026-10-12 (Watchtower 2.8): still no official announcement — the state-of-the-field coverage page this watch reads returned a signature identical to the 2.6/2.7 baseline (59931bf3…) and still lists Seedance 3.0 among models announced by no vendor as of October 1, with no announcement, no API, and no date — watch stays open. Re-checked 2026-10-12 (Watchtower 2.9): still no official announcement — the state-of-the-field coverage page this watch reads returned a signature identical to the 2.6/2.7/2.8 baseline (59931bf3…) in the pre-run probe, the first checker run, and the post-run probe, and still lists Seedance 3.0 among models announced by no vendor as of October 1, with no announcement, no API, and no date — watch stays open.",
      "watch": [
        "seedance 3.0 launch",
        "bytedance seedance 3 official"
      ]
    },
    {
      "model": "Kling 4.0",
      "status": "announced",
      "note": "Wave 21 (2026-10-11): full model promised 'this October' with no date. Watch kling.ai and the official API docs for a GA model ID; on GA, flip status to active and add pricing. Re-checked 2026-10-12 (Watchtower 2.3): APIMart still lists the API as a preview with pricing unpublished — criteria unmet, watch stays open. Re-checked 2026-10-12 (Watchtower 2.4): full model still staged for October with no date, API packs do not cover 4.0, no GA model ID, no pricing — watch stays open. Re-checked 2026-10-12 (Watchtower 2.5): APIMart's page is signature-identical to the 2.4 baseline and still reads 'API Coming Soon' with pricing 'not been announced'; third-party subscription noise (kling4.tv plans) is not official pricing and carries no GA model ID — criteria unmet, watch stays open. Re-checked 2026-10-12 (Watchtower 2.6): APIMart’s page returned a signature identical to the 2.4/2.5 baseline (fc55ce30…) and still reads ‘API Coming Soon’, ‘Not yet’, pricing ‘not been announced’; current coverage still describes Flash-only subscriber access with no published API pricing and no GA model ID from Kuaishou — criteria unmet, watch stays open. Re-checked 2026-10-12 (Watchtower 2.7): APIMart's page returned a signature identical to the 2.4/2.5/2.6 baseline (fc55ce30…) and still reads 'API Coming Soon', 'Not yet', pricing 'not been announced'; third-party wrappers are not Kuaishou pricing and carry no GA model ID (MuAPI's Kling 4 routes run on its existing pipeline, by its own README) — criteria unmet, watch stays open. Re-checked 2026-10-12 (Watchtower 2.8): APIMart's page returned a signature identical to the 2.4/2.5/2.6/2.7 baseline (fc55ce30…) and still reads 'API Coming Soon', 'Not yet', pricing 'not been announced'; no GA model ID and no pricing published by Kuaishou — criteria unmet, watch stays open. Re-checked 2026-10-12 (Watchtower 2.9): APIMart's page returned a signature identical to the 2.4/2.5/2.6/2.7/2.8 baseline (fc55ce30…) in the pre-run probe, the first checker run, and the post-run probe, and still reads 'API Coming Soon', 'Not yet', pricing 'not been announced'; no GA model ID, no pricing published by Kuaishou — criteria unmet, watch stays open.",
      "watch": [
        "kling 4.0 general availability",
        "kling 4.0 API pricing"
      ]
    },
    {
      "model": "Soul Cinema",
      "status": "active",
      "note": "Wave 21 (2026-10-11): now the default image model in Cinema Studio 3.0/3.5; per-image credit cost still unpublished. Watch the Higgsfield pricing page. Update 2026-10-12 (Watchtower 2.3): Higgsfield's API post now publishes a $0.0032/image starting rate — tabled in pricing.json. The watch narrows to the in-app per-image credit cost. Re-checked 2026-10-12 (Watchtower 2.4): in-app credit cost still unpublished by Higgsfield (third-party ~0.125 credits/image only) — watch stays open, still narrowed. Re-checked 2026-10-12 (Watchtower 2.5): in-app credit cost still unpublished by Higgsfield — its pricing page serves no credit figure and the API post's rate table still lists only the $0.0032/image API starting rate (unchanged); third-party ~0.125 credits/image remains the only credit figure — watch stays open, still narrowed. Re-checked 2026-10-12 (Watchtower 2.6): in-app credit cost still unpublished by Higgsfield — its pricing page is a 428-char app shell carrying no credit figure, and the API post’s rate table still lists only the $0.0032/image API starting rate (its signature moved again at identical length; already excluded since 2.4); third-party ~0.125 credits/image remains the only credit figure — watch stays open, still narrowed. Re-checked 2026-10-12 (Watchtower 2.7): in-app credit cost still unpublished by Higgsfield — its pricing page returned the same 428-char app shell at the settled signature (f14e9f4a…) with no credit figure, and the API post's rate table still lists only the $0.0032/image API starting rate (the post returned yet another signature at identical length; already excluded since 2.4) — watch stays open, still narrowed. Re-checked 2026-10-12 (Watchtower 2.8): in-app credit cost still unpublished by Higgsfield — its pricing page returned the same 428-char app shell at the settled signature (f14e9f4a…) with no credit figure, and the API post's rate table still lists only the $0.0032/image API starting rate (the post returned yet another signature at identical length; already excluded since 2.4) — watch stays open, still narrowed. Re-checked 2026-10-12 (Watchtower 2.9): the in-app credit cost is still unpublished — Higgsfield's pricing page returned the same 428-char app shell at the settled signature (f14e9f4a…) in probes and in the first checker run, with no credit figure; the API post's rate table still lists only the $0.0032/image API starting rate tabled in 2.3 (the post is signature-excluded since 2.4) — watch stays open, still narrowed.",
      "watch": [
        "higgsfield soul cinema pricing"
      ]
    }
  ]
}
